move_id,name_es,name_en,type,category,power,accuracy,pp,priority,ailment,ailment_chance,created_at,description_es
629,Diluvio Corrosivo,acid-downpour--special,poison,special,,,1,0,,0,2026-03-08 04:32:17.235039+00,Dummy data
630,Barrena Telúrica,tectonic-rage--physical,ground,physical,,,1,0,,0,2026-03-08 04:32:17.269835+00,Emplea el Poder Z para abrir una profunda grieta en el suelo que se traga al oponente. Su potencia depende de la del movimiento original.
631,Barrena Telúrica,tectonic-rage--special,ground,special,,,1,0,,0,2026-03-08 04:32:18.522771+00,Dummy data
632,Aplastamiento Gigalítico,continental-crush--physical,rock,physical,,,1,0,,0,2026-03-08 04:32:18.48327+00,El usuario emplea el Poder Z para crear una montaña rocosa con la que aplasta al objetivo. Su potencia depende de la del movimiento original.
633,Aplastamiento Gigalítico,continental-crush--special,rock,special,,,1,0,,0,2026-03-08 04:32:18.533475+00,Dummy data
634,Guadaña Sedosa,savage-spin-out--physical,bug,physical,,,1,0,,0,2026-03-08 04:32:18.519374+00,Emplea el Poder Z para encerrar a su oponente en un capullo contra el que arremete con fuerza. Su potencia depende de la del movimiento original.
635,Guadaña Sedosa,savage-spin-out--special,bug,special,,,1,0,,0,2026-03-08 04:32:18.549151+00,Dummy data
636,Presa Espectral,never-ending-nightmare--physical,ghost,physical,,,1,0,,0,2026-03-08 04:32:18.544315+00,El usuario emplea el Poder Z para invocar a unos espectros encolerizados que apresan al objetivo. Su potencia depende de la del movimiento original.
637,Presa Espectral,never-ending-nightmare--special,ghost,special,,,1,0,,0,2026-03-08 04:32:18.682228+00,Dummy data
638,Hélice Trepanadora,corkscrew-crash--physical,steel,physical,,,1,0,,0,2026-03-08 04:32:18.536394+00,El usuario emplea el Poder Z para girar a toda velocidad y perforar al objetivo. Su potencia depende de la del movimiento original.
639,Hélice Trepanadora,corkscrew-crash--special,steel,special,,,1,0,,0,2026-03-08 04:32:18.537749+00,Dummy data
640,Hecatombe Pírica,inferno-overdrive--physical,fire,physical,,,1,0,,0,2026-03-08 04:32:18.560747+00,El usuario emplea el Poder Z para lanzar una enorme llamarada con la que calcina a su objetivo. Su potencia depende de la del movimiento original.
641,Hecatombe Pírica,inferno-overdrive--special,fire,special,,,1,0,,0,2026-03-08 04:32:19.937125+00,Dummy data
642,Hidrovórtice Abisal,hydro-vortex--physical,water,physical,,,1,0,,0,2026-03-08 04:32:19.929104+00,El usuario emplea el Poder Z para crear un potente torbellino de agua que engulle al objetivo. Su potencia depende de la del movimiento original.
643,Hidrovórtice Abisal,hydro-vortex--special,water,special,,,1,0,,0,2026-03-08 04:32:19.939415+00,Dummy data
644,Megatón Floral,bloom-doom--physical,grass,physical,,,1,0,,0,2026-03-08 04:32:19.923023+00,Emplea el Poder Z para concentrar la energía de la vegetación que lo rodea y atacar al objetivo. Su potencia depende de la del movimiento original.
645,Megatón Floral,bloom-doom--special,grass,special,,,1,0,,0,2026-03-08 04:32:19.932363+00,Dummy data
646,Gigavoltio Destructor,gigavolt-havoc--physical,electric,physical,,,1,0,,0,2026-03-08 04:32:19.880013+00,El usuario emplea el Poder Z para generar una fuerte descarga eléctrica con la que electrocuta al objetivo. Su potencia depende de la del movimiento original.
647,Gigavoltio Destructor,gigavolt-havoc--special,electric,special,,,1,0,,0,2026-03-08 04:32:19.942926+00,Dummy data
648,Disruptor Psíquico,shattered-psyche--physical,psychic,physical,,,1,0,,0,2026-03-08 04:32:19.946551+00,"Emplea el Poder Z para manipular la mente del objetivo, infligiéndole un daño ingente. Su potencia depende de la del movimiento original."
649,Disruptor Psíquico,shattered-psyche--special,psychic,special,,,1,0,,0,2026-03-08 04:32:19.937452+00,Dummy data
650,Crioaliento Despiadado,subzero-slammer--physical,ice,physical,,,1,0,,0,2026-03-08 04:32:19.935349+00,Emplea el Poder Z para lanzar un rayo de hielo que baja la temperatura de golpe y congela al objetivo. Su potencia depende de la del movimiento original.
651,Crioaliento Despiadado,subzero-slammer--special,ice,special,,,1,0,,0,2026-03-08 04:32:21.199928+00,Dummy data
652,Dracoaliento Devastador,devastating-drake--physical,dragon,physical,,,1,0,,0,2026-03-08 04:32:21.22062+00,El usuario emplea el Poder Z para materializar su aura y golpear al objetivo. Su potencia depende de la del movimiento original.
653,Dracoaliento Devastador,devastating-drake--special,dragon,special,,,1,0,,0,2026-03-08 04:32:21.201574+00,Dummy data
654,Agujero Negro Aniquilador,black-hole-eclipse--physical,dark,physical,,,1,0,,0,2026-03-08 04:32:21.190026+00,El usuario emplea el Poder Z para generar un agujero negro que absorbe al objetivo. Su potencia depende de la del movimiento original.
655,Agujero Negro Aniquilador,black-hole-eclipse--special,dark,special,,,1,0,,0,2026-03-08 04:32:21.15134+00,Dummy data
656,Arrumaco Sideral,twinkle-tackle--physical,fairy,physical,,,1,0,,0,2026-03-08 04:32:21.193075+00,El usuario emplea el Poder Z para crear una dimensión fascinante que deja al rival a su merced. Su potencia depende de la del movimiento original.
657,Arrumaco Sideral,twinkle-tackle--special,fairy,special,,,1,0,,0,2026-03-08 04:32:21.191842+00,Dummy data
658,Pikavoltio Letal,catastropika,electric,physical,210,,1,0,,0,2026-03-08 04:32:21.202593+00,Pikachu emplea el Poder Z para acumular una gran cantidad de electricidad en su cuerpo y arremeter contra el objetivo.
659,Recogearena,shore-up,ground,status,,,5,0,,0,2026-03-06 14:11:02.743247+00,"Restaura la mitad de los PS máximos del usuario. Durante las tormentas de arena, restaura aún más PS."
660,Escaramuza,first-impression,bug,physical,90,100,10,2,,0,2026-03-06 14:11:00.975267+00,Movimiento de gran potencia que solo puede usarse en el turno en que el usuario sale al combate.
661,Búnker,baneful-bunker,poison,status,,,10,4,,0,2026-03-06 14:09:27.895761+00,"Protege de los ataques y, al mismo tiempo, envenena al Pokémon que use un movimiento de contacto contra el usuario."
662,Puntada Sombría,spirit-shackle,ghost,physical,80,100,10,0,,0,2026-03-08 04:32:22.513348+00,"Ataca al oponente y, al mismo tiempo, fija su sombra al terreno, impidiendo su huida."
663,Lariat Oscuro,darkest-lariat,dark,physical,85,100,10,0,,0,2026-03-06 14:07:53.868773+00,Gira sobre sí mismo y golpea al oponente con ambos brazos. Ignora los cambios en las características del objetivo.
664,Aria Burbuja,sparkling-aria,water,special,90,100,10,0,,0,2026-03-06 14:08:10.020979+00,Libera burbujas al cantar. Este movimiento cura las quemaduras de los Pokémon que reciban daño.
665,Martillo Hielo,ice-hammer,ice,physical,100,90,10,0,,0,2026-03-06 14:08:48.525266+00,"Un terrible puño golpea al contrincante, pero la Velocidad del usuario se ve reducida."
666,Cura Floral,floral-healing,fairy,status,,,10,0,,0,2026-03-06 14:10:41.600841+00,Restaura la mitad de los PS máximos del objetivo. Es más efectivo cuando se usa en conjunción con Campo de Hierba.
667,Fuerza Equina,high-horsepower,ground,physical,95,95,10,0,,0,2026-03-06 13:27:10.461006+00,Asesta un golpe devastador usando todo su cuerpo.
668,Absorbefuerza,strength-sap,grass,status,,100,10,0,,0,2026-03-06 14:09:57.542277+00,"Restaura una cantidad de PS equivalente al valor de Ataque del rival, que además verá reducida esta característica."
669,Cuchilla Solar,solar-blade,grass,physical,125,100,10,0,,0,2026-03-06 14:09:52.341238+00,El usuario dedica un turno a absorber energía lumínica y concentrarla en forma de cuchilla con la que ataca al rival al turno siguiente.
670,Follaje,leafage,grass,physical,40,100,40,0,,0,2026-03-06 13:36:46.905293+00,Ataca al oponente lanzando hojas.
671,Foco,spotlight,normal,status,,,15,3,,0,2026-03-06 13:28:09.406077+00,"Convierte a uno de los Pokémon que están combatiendo en el foco de atención, de modo que todos los ataques se dirijan hacia él."
672,Hilo Venenoso,toxic-thread,poison,status,,100,20,0,PSN,100,2026-03-06 13:31:53.706815+00,Ataca al oponente con hilillos venenosos que reducen su Velocidad y lo envenenan.
673,Aguzar,laser-focus,normal,status,,,30,0,,0,2026-03-06 13:27:42.426615+00,El usuario se concentra para que el siguiente ataque propine un golpe crítico.
674,Piñón Auxiliar,gear-up,steel,status,,,20,0,,0,2026-03-07 22:29:17.50326+00,Cambia de marcha y logra aumentar el Ataque y el Ataque Especial de los Pokémon aliados que cuenten con las habilidades Más y Menos.
675,Golpe Mordaza,throat-chop,dark,physical,80,100,15,0,,100,2026-03-06 13:35:27.422081+00,Inflige al rival un dolor tan abrumador que le impide utilizar durante dos turnos ataques que se sirven del sonido.
676,Bola de Polen,pollen-puff,bug,special,90,100,15,0,,0,2026-03-06 14:09:03.555544+00,"Ataca al oponente con una bola explosiva. Si esta alcanza a un aliado, le hará recuperar PS."
677,Anclaje,anchor-shot,steel,physical,80,100,20,0,,0,2026-03-06 14:12:13.892606+00,"Ataca lanzando un ancla al oponente, que queda atrapado y no puede huir."
678,Campo Psíquico,psychic-terrain,psychic,status,,,10,0,,0,2026-03-06 13:55:26.460557+00,"Durante cinco turnos, se potencian los movimientos de tipo Psíquico y los Pokémon que están en el suelo quedan protegidos contra movimientos con prioridad."
679,Plancha,lunge,bug,physical,80,100,15,0,,0,2026-03-06 13:48:25.29218+00,Ataca al oponente abalanzándose sobre él con todas sus fuerzas y reduce su Ataque.
680,Látigo Ígneo,fire-lash,fire,physical,80,100,15,0,,0,2026-03-06 14:17:20.188435+00,Golpea al oponente con un látigo incandescente y reduce su Defensa.
681,Chulería,power-trip,dark,physical,20,100,10,0,,0,2026-03-06 13:43:13.962606+00,"Ataca al oponente presumiendo de su fuerza. Cuanto más hayan subido las características del usuario, mayor será el daño."
682,Llama Final,burn-up,fire,special,130,100,5,0,,0,2026-03-06 13:30:21.897661+00,"Utiliza hasta el último resquicio de llamas de su cuerpo para infligir un grave daño al oponente. Tras el ataque, el usuario deja de ser de tipo Fuego."
683,Cambiavelocidad,speed-swap,psychic,status,,,10,0,,0,2026-03-06 14:13:41.130793+00,Intercambia su Velocidad por la del oponente.
684,Cuerno Certero,smart-strike,steel,physical,70,,10,0,,0,2026-03-07 22:56:50.90582+00,Ensarta al adversario con su afilada cornamenta. Este movimiento acierta siempre.
685,Purificación,purify,poison,status,,,20,0,,0,2026-03-06 14:11:15.388217+00,Cura los problemas de estado del Pokémon rival y a cambio recupera PS propios.
686,Danza Despertar,revelation-dance,normal,special,90,100,15,0,,0,2026-03-06 14:08:53.048812+00,Ataque que consiste en un baile muy enérgico. El tipo de este ataque se corresponde con el del Pokémon que lo ejecuta.
687,Núcleo Castigo,core-enforcer,dragon,special,100,100,10,0,,0,2026-03-08 04:32:25.116543+00,"Inflige daño al rival, y si este ya ha hecho uso de algún movimiento, pierde su habilidad."
688,Patada Tropical,trop-kick,grass,physical,70,100,15,0,,0,2026-03-06 14:10:36.226136+00,Lanza una patada con la fuerza del trópico que golpea al rival y reduce su Ataque.
689,Mandato,instruct,psychic,status,,,15,0,,0,2026-03-06 14:10:46.61786+00,Fuerza al objetivo a repetir inmediatamente su último movimiento.
690,Pico Cañón,beak-blast,flying,physical,100,100,15,-3,,0,2026-03-06 14:08:21.342277+00,Primero aumenta la temperatura de su pico y luego ejecuta un ataque. Quema al rival si este le propina un ataque físico mientras está calentando el pico.
691,Fragor Escamas,clanging-scales,dragon,special,110,100,5,0,,0,2026-03-08 04:32:26.418252+00,"Frota todas las escamas de su cuerpo para crear un fuerte sonido con el que ataca. Cuando el ataque termina, su Defensa se ve reducida."
692,Martillo Dragón,dragon-hammer,dragon,physical,90,100,15,0,,0,2026-03-07 22:09:52.329114+00,Usa el cuerpo como un martillo para abalanzarse sobre su rival y causarle daño.
693,Giro Vil,brutal-swing,dark,physical,60,100,20,0,,0,2026-03-06 14:10:19.06072+00,Hace pivotar su cuerpo para infligir daño a su rival.
694,Velo Aurora,aurora-veil,ice,status,,,20,0,,0,2026-03-06 13:52:38.488569+00,Reduce el daño de los ataques físicos y especiales que ejecuta el rival durante cinco turnos. Solo puede usarse cuando está granizando.
695,Aluvión de Flechas Sombrías,sinister-arrow-raid,ghost,physical,180,,1,0,,0,2026-03-08 04:32:26.369204+00,Decidueye usa el Poder Z para proyectar multitud de flechas potentísimas que atraviesan a su oponente.
696,Hiperplancha Oscura,malicious-moonsault,dark,physical,180,,1,0,,0,2026-03-08 04:32:26.423042+00,Incineroar refuerza sus músculos con el Poder Z para golpear con todas sus fuerzas a su oponente.
697,Sinfonía de la Diva Marina,oceanic-operetta,water,special,195,,1,0,,0,2026-03-08 04:32:26.339229+00,Primarina invoca ingentes cantidades de agua con el Poder Z para atacar con gran potencia a su rival.
698,Cólera del Guardián,guardian-of-alola,fairy,special,,,1,0,,0,2026-03-08 04:32:26.371151+00,Los Pokémon Dios Nativo canalizan la energía de Alola gracias al Poder Z y atacan con gran fuerza a sus rivales reduciendo un gran porcentaje de sus PS.
699,Constelación Robaalmas,soul-stealing-7-star-strike,ghost,physical,195,,1,0,,0,2026-03-08 04:32:26.355835+00,"Cuando Marshadow obtiene el Poder Z, lanza una potente y continua oleada de puñetazos y patadas con la que castiga a su rival."
700,Surfeo Galvánico,stoked-sparksurfer,electric,special,175,,1,0,PAR,100,2026-03-08 04:32:26.317143+00,"Cuando un Raichu de Alola obtiene el Poder Z, lanza un potente ataque contra su enemigo y lo deja paralizado."
701,Arrojo Intempestivo,pulverizing-pancake,normal,physical,210,,1,0,,0,2026-03-08 04:32:27.695449+00,"Gracias al Poder Z, Snorlax puede mover su enorme cuerpo con gran agilidad y determinación, cargando sobre el oponente con todas sus fuerzas."
702,Novena Potencia,extreme-evoboost,normal,status,,,1,0,,0,2026-03-08 04:32:27.711524+00,"Cuando Eevee obtiene el Poder Z, toma prestada la energía de sus amigos evolucionados para potenciar enormemente sus características."
703,Supernova Original,genesis-supernova,psychic,special,185,,1,0,,0,2026-03-08 04:32:27.692136+00,Mew usa el Poder Z para realizar un potente ataque contra su adversario y crear un Campo Psíquico sobre el terreno.
704,Coraza Trampa,shell-trap,fire,special,150,100,5,-3,,0,2026-03-06 14:11:45.984678+00,"El caparazón del Pokémon se convierte en una trampa. Si le alcanza un ataque físico, la trampa estalla y el atacante sufre daño."
705,Cañón Floral,fleur-cannon,fairy,special,130,90,5,0,,0,2026-03-07 22:55:31.907876+00,"El usuario emite un potente rayo, pero su Ataque Especial se reduce mucho."
706,Psicocolmillo,psychic-fangs,psychic,physical,85,100,10,0,,0,2026-03-06 14:12:02.894928+00,Ataca a sus rivales con poderes psíquicos que además destruyen barreras como Pantalla de Luz y Reflejo.
707,Pataleta,stomping-tantrum,ground,physical,75,100,10,0,,0,2026-03-06 13:26:32.036737+00,Usa la frustración como revulsivo para atacar. La potencia de Pataleta se duplica si el usuario ha fallado el último movimiento usado.
708,Hueso Sombrío,shadow-bone,ghost,physical,85,100,10,0,,0,2026-03-08 04:32:27.677002+00,Ataca al oponente golpeándole con un hueso poseído por un espíritu. Puede reducir la Defensa del objetivo.
709,Roca Veloz,accelerock,rock,physical,40,100,20,1,,0,2026-03-06 14:09:15.880451+00,El usuario se lanza contra el objetivo a gran velocidad. Siempre ataca primero.
710,Hidroariete,liquidation,water,physical,85,100,10,0,,0,2026-03-06 13:29:45.920883+00,Ataca golpeando gracias a la fuerza del agua. También puede reducir la Defensa del objetivo.
711,Láser Prisma,prismatic-laser,psychic,special,160,100,10,0,,0,2026-03-06 14:13:20.345256+00,"El usuario utiliza un prisma para emitir un rayo de gran potencia, pero no puede moverse en el turno siguiente."
712,Robasombra,spectral-thief,ghost,physical,90,100,10,0,,0,2026-03-07 22:55:32.139044+00,El usuario se esconde en la sombra del objetivo y lo ataca tras robarle las mejoras en sus características.
713,Meteoimpacto,sunsteel-strike,steel,physical,100,100,5,0,,0,2026-03-06 14:13:12.609215+00,"Ataca al objetivo con la potencia de un meteoro, ignorando su habilidad."
714,Rayo Umbrío,moongeist-beam,ghost,special,100,100,5,0,,0,2026-03-06 14:13:18.784837+00,Ataca con un rayo misterioso que ignora la habilidad del objetivo.
715,Ojos Llorosos,tearful-look,normal,status,,,20,0,,0,2026-03-06 13:33:00.109189+00,Mira al objetivo con ojos llorosos para hacerle perder su espíritu combativo y reduce su Ataque y Ataque Especial.
716,Electropunzada,zing-zap,electric,physical,80,100,10,0,,0,2026-03-06 14:11:52.689491+00,El usuario se lanza contra el objetivo y le suelta una potente descarga eléctrica que puede hacerlo retroceder.
717,Furia Natural,natures-madness,fairy,special,,90,10,0,,0,2026-03-06 14:12:40.622599+00,Golpea al objetivo con la furia de la naturaleza y reduce sus PS a la mitad.
718,Multiataque,multi-attack,normal,physical,120,100,10,0,,0,2026-03-08 04:32:28.948102+00,El Pokémon se rodea de una potente energía con la que golpea al rival. El tipo del movimiento depende del disco que lleva el usuario.
719,Gigarrayo Fulminante,10-000-000-volt-thunderbolt,electric,special,195,,1,0,,0,2026-03-08 04:32:28.952678+00,Los Pikachu con gorra acumulan una carga eléctrica descomunal gracias al Poder Z y la lanzan contra el objetivo. Suele ser crítico.
720,Cabeza Sorpresa,mind-blown,fire,special,150,100,5,0,,0,2026-03-06 14:14:38.705474+00,"El usuario hace explotar su cabeza para atacar a todos los Pokémon que se hallan a su alrededor, aunque también se hiere a sí mismo."
721,Puños Plasma,plasma-fists,electric,physical,100,100,15,0,,0,2026-03-07 22:55:31.908703+00,El usuario ataca con puños cargados de electricidad. Convierte los movimientos de tipo Normal en movimientos de tipo Eléctrico.
722,Géiser Fotónico,photon-geyser,psychic,special,100,100,5,0,,0,2026-03-06 14:13:21.265927+00,El usuario ataca con una gran columna de luz. Compara sus valores de Ataque y Ataque Especial para infligir daño con el más alto de los dos.
723,Fotodestrucción Apocalíptica,light-that-burns-the-sky,psychic,special,200,,1,0,,0,2026-03-08 04:32:30.190822+00,"Necrozma escoge la característica que tenga el valor más alto entre el Ataque y el Ataque Especial para infligir daño, ignorando la habilidad del objetivo."
724,Embestida Solar,searing-sunraze-smash,steel,physical,200,,1,0,,0,2026-03-08 04:32:30.193052+00,Solgaleo ataca con toda su fuerza tras imbuirse del Poder Z. Este movimiento ignora la habilidad del objetivo.
725,Deflagración Lunar,menacing-moonraze-maelstrom,ghost,special,200,,1,0,,0,2026-03-08 04:32:30.207824+00,Lunala ataca con toda su fuerza tras imbuirse del Poder Z. Este movimiento ignora la habilidad del objetivo.
726,Somanta Amistosa,lets-snuggle-forever,fairy,physical,190,,1,0,,0,2026-03-08 04:32:30.276417+00,Mimikyu ataca con toda su fuerza tras imbuirse del Poder Z y asesta una lluvia de golpes.
727,Tempestad Rocosa,splintered-stormshards,rock,physical,190,,1,0,,0,2026-03-08 04:32:30.217766+00,Lycanroc ataca con toda su fuerza tras imbuirse del Poder Z y neutraliza el campo que esté activo.
728,Estruendo Implacable,clangorous-soulblaze,dragon,special,185,,1,0,,0,2026-03-08 04:32:30.199703+00,"Kommo-o ataca con toda su fuerza al objetivo tras imbuirse del Poder Z. Además, potencia sus propias características."
729,Pikaturbo,zippy-zap,electric,physical,80,100,10,2,,0,2026-03-08 04:32:30.165811+00,Ataque eléctrico a la velocidad del rayo. Este movimiento tiene prioridad alta y propina golpes críticos.
730,Salpikasurf,splishy-splash,water,special,90,100,15,0,PAR,30,2026-03-08 04:32:30.189174+00,"Golpea al adversario con una ola gigante electrificada, que también puede paralizarlo."
731,Pikapicado,floaty-fall,flying,physical,90,95,15,0,,0,2026-03-08 04:32:31.505989+00,"El usuario se suspende en el aire para, a continuación, abalanzarse súbitamente sobre el rival. Puede hacer retroceder al objetivo."
732,Pikatormenta,pika-papow,electric,special,,,20,0,,0,2026-03-08 04:32:31.493775+00,Lanza una descarga eléctrica infalible que resulta más potente cuanto mayor es el cariño que siente Pikachu hacia su Entrenador.
733,Vapodrenaje,bouncy-bubble,water,special,60,100,20,0,,0,2026-03-08 04:32:31.519594+00,Ataca lanzando proyectiles de agua y recupera una cantidad de PS equivalente a la mitad del daño causado.
734,Joltioparálisis,buzzy-buzz,electric,special,60,100,20,0,PAR,100,2026-03-08 04:32:31.490108+00,Lanza una potente descarga eléctrica sobre el rival y lo deja paralizado.
735,Flarembestida,sizzly-slide,fire,physical,60,100,20,0,BRN,100,2026-03-08 04:32:31.510373+00,"Tras envolver su cuerpo en llamas, el usuario arrolla con fuerza al rival y le provoca quemaduras."
736,Espeaura,glitzy-glow,psychic,special,80,95,15,0,,0,2026-03-08 04:32:31.481874+00,Envuelve al rival con ondas psíquicas y alza un extraño muro que debilita los ataques especiales del adversario.
737,Umbreozona,baddy-bad,dark,special,80,95,15,0,,0,2026-03-08 04:32:31.514411+00,Lanza un ataque haciendo gala de su faceta más umbría y alza un extraño muro que mitiga los ataques físicos del adversario.
738,Leafitobombas,sappy-seed,grass,physical,100,90,10,0,,100,2026-03-08 04:32:31.521553+00,Hace brotar un tallo gigante que bombardea al rival con unas semillas que le drenan PS en cada turno.
739,Glaceoprisma,freezy-frost,ice,special,100,90,10,0,,0,2026-03-08 04:32:31.57059+00,Ataca al rival con negros cristales de niebla congelada. Revierte los cambios en las características de todos los Pokémon presentes.
740,Sylveotornado,sparkly-swirl,fairy,special,120,85,5,0,,0,2026-03-08 04:32:31.51801+00,Ataca al rival envolviéndolo en un remolino de aroma asfixiante. Cura a los aliados de cualquier problema de estado.
741,Eevimpacto,veevee-volley,normal,physical,,,20,0,,0,2026-03-08 04:32:32.922001+00,Un placaje infalible que resulta más potente cuanto mayor es el cariño que siente Eevee hacia su Entrenador.
742,Ferropuño Doble,double-iron-bash,steel,physical,60,100,5,0,,0,2026-03-07 22:55:31.91914+00,"Usando la tuerca del pecho como eje, el usuario gira sobre sí mismo y golpea con los brazos dos veces seguidas. Puede hacer retroceder al rival."
743,Maxibarrera,max-guard,normal,status,,,10,4,,0,2026-03-08 04:32:32.924397+00,"Frena todos los ataques, pero puede fallar si se usa repetidamente."
744,Cañón Dinamax,dynamax-cannon,dragon,special,100,100,5,0,,0,2026-03-06 14:20:01.971932+00,El usuario ataca emitiendo un rayo desde su núcleo. El daño infligido se duplica si el objetivo ha alcanzado el estado Dinamax.
745,Disparo Certero,snipe-shot,water,special,80,100,15,0,,0,2026-03-06 14:15:24.816897+00,Permite atacar al objetivo seleccionado ignorando las habilidades o movimientos que permiten a un rival centrar la atención sobre sí.
746,Presa Maxilar,jaw-lock,dark,physical,80,100,10,0,,0,2026-03-06 14:16:19.594799+00,Impide que tanto el atacante como el defensor puedan ser intercambiados hasta que uno de ellos se debilite o abandone el terreno de combate.
747,Atiborramiento,stuff-cheeks,normal,status,,,10,0,,0,2026-03-06 14:15:28.773027+00,El usuario ingiere la baya que lleva equipada para aumentar mucho su Defensa.
748,Bastión Final,no-retreat,fighting,status,,,5,0,,0,2026-03-06 14:18:42.639225+00,"El usuario aumenta todas sus características, pero ya no puede huir ni ser cambiado por otro."
749,Alquitranazo,tar-shot,rock,status,,100,15,0,,100,2026-03-06 14:16:41.369643+00,Cubre al objetivo de un alquitrán pegajoso que reduce su Velocidad y lo vuelve débil contra el fuego.
750,Polvo Mágico,magic-powder,psychic,status,,100,20,0,,0,2026-03-06 14:17:48.498671+00,Cubre al objetivo con unos polvos mágicos que le hacen adquirir el tipo Psíquico.
751,Dracoflechas,dragon-darts,dragon,physical,50,100,10,0,,0,2026-03-06 14:19:52.019301+00,"El usuario ataca propulsando a ambos Dreepy. En caso de haber dos adversarios, cada Dreepy golpea a su propio objetivo por separado."
752,Hora del Té,teatime,normal,status,,,10,0,,0,2026-03-06 14:17:40.410098+00,"El usuario invita a tomar el té a todos los presentes en el terreno de combate, lo que hace que ingieran las bayas que lleven equipadas."
753,Octopresa,octolock,fighting,status,,100,15,0,,0,2026-03-06 14:17:32.869051+00,"Retiene al objetivo para impedir su huida, a la vez que reduce su Defensa y Defensa Especial cada turno."
754,Electropico,bolt-beak,electric,physical,85,100,10,0,,0,2026-03-06 14:19:18.283277+00,"El usuario ensarta al objetivo con su pico cargado de electricidad. Si ataca en primer lugar, la potencia del movimiento se duplica."
755,Branquibocado,fishious-rend,water,physical,85,100,10,0,,0,2026-03-06 14:19:25.374097+00,"El usuario agarra al objetivo con sus duras branquias. En caso de atacar antes que este último, la potencia del movimiento se duplica."
756,Cambio de Cancha,court-change,normal,status,,100,10,0,,0,2026-03-06 14:15:07.64281+00,Extraño poder que intercambia los efectos en el terreno de combate de ambos bandos.
757,Maxignición,max-flare,fire,physical,100,,10,0,,0,2026-03-08 04:32:34.202617+00,Ataque de tipo Fuego ejecutado por un Pokémon Dinamax. Hace que se intensifique el efecto del sol durante cinco turnos.
758,Maxinsecto,max-flutterby,bug,physical,10,,10,0,,0,2026-03-08 04:32:34.225318+00,Ataque de tipo Bicho ejecutado por un Pokémon Dinamax. Reduce el Ataque Especial del objetivo.
759,Maxitormenta,max-lightning,electric,physical,10,,10,0,,0,2026-03-08 04:32:34.207864+00,Ataque de tipo Eléctrico ejecutado por un Pokémon Dinamax. Crea un campo eléctrico durante cinco turnos.
760,Maxiataque,max-strike,normal,physical,10,,10,0,,0,2026-03-08 04:32:34.207864+00,Ataque de tipo Normal ejecutado por un Pokémon Dinamax. Reduce la Velocidad del objetivo.
